{
  "schema_version": 1,
  "power_law": {
    "genesis_date": "2009-01-03",
    "fit_start_date": "2010-07-17",
    "sampling": "daily, no downsampling",
    "weighting": "unweighted OLS in log10(price) vs log10(days-since-genesis) space",
    "price_series_source": "data/history/price_daily.json",
    "expected_range": {
      "b": [
        5.7,
        5.9
      ],
      "a": [
        -17.0,
        -16.5
      ],
      "r_squared_min": 0.95
    },
    "audit_drift_thresholds": {
      "b_warn_outside_range": [
        5.4,
        6.1
      ],
      "r_squared_drop_warn": 0.01,
      "b_day_over_day_pct_warn": 0.005
    },
    "cycle_top_drawdown_confirm_pct": 0.7,
    "cycle_top_recovery_confirm_pct": 0.5,
    "cycle_top_note": "ZigZag swing detection over the same price_daily.json this fit already uses: a running high is confirmed a cycle top once price later falls cycle_top_drawdown_confirm_pct from it; a running low is confirmed a bottom once price later rises cycle_top_recovery_confirm_pct from it. 70%/50% were chosen because they reproduce the canonical list of major Bitcoin cycle tops with zero hand-picking (verified against the full committed history). This is one of three mechanical rules compute_cycle_tops() unions (the other two: each halving era's own peak sigma-vs-trend excursion, and the current open era's highest close to date) -- see MODEL_METHODOLOGY.md before changing any of it. Every point is reported as its deviation (sigma_vs_trend) from THIS SAME fit's a/b/sigma -- no second curve is fit through the tops themselves."
  },
  "cycle_overlay": {
    "halving_dates": [
      "2012-11-28",
      "2016-07-09",
      "2020-05-11",
      "2024-04-20"
    ],
    "next_halving_est_date": "2028-04",
    "next_halving_height": 1050000
  },
  "honesty": {
    "band_quantiles": {
      "outer": [
        0.025,
        0.975
      ],
      "inner": [
        0.16,
        0.84
      ]
    },
    "bootstrap": {
      "block_days": 730,
      "reps": 300,
      "seed": 42,
      "percentiles": [
        5,
        50,
        95
      ]
    },
    "realtime_z_start_date": "2013-01-01",
    "scenario_fit_start_date": "2017-01-01",
    "short_term": {
      "sample_days": 30,
      "steps": 12
    },
    "note": "Phases B-D (2026-10-01). Bands are empirical residual quantiles (walk-forward calibration published in data/backtest.json; a time-decaying band variant was tested and rejected as overconfident, ~77% realised coverage for a nominal 95%). Trend uncertainty is a circular block bootstrap of residuals (730-day blocks preserve multi-year autocorrelation; fixed seed keeps the nightly refit deterministic). See MODEL_METHODOLOGY.md 'Model honesty' before changing any value -- each is a methodology change, not a data update."
  }
}
